{
"schema_version":1,
"benchmark_id":"scratch-retention-policies-v1",
"purpose":"host_specific_retention_policy_evidence_not_performance_claim",
"recorded_at_utc":"2026-08-06T06:09:40Z",
"fixture":{"name":"scratch-retention-linear-v1","checkpoint_count":25,"checksum":{"algorithm":"sha256","value":"77f970749ac96aec6cdeff0cb02a39da7e801590498ed5e4e6006ce2d946c247"}},
"execution":{"repetitions":5,"warmup_runs":0,"concurrency":1,"cache_state":"mixed"},
"environment":{"os":"Unix","word_size_bits":64,"ocaml_version":"5.5.0","dune_profile":"release","filesystem_scope":"temporary local directory"},
"policies":[
    {"name":"keep-all","policy":{"recent_window_seconds":30,"periodic_interval_seconds":0,"storage_budget_bytes":null},"samples":[{"restore_ns":14497995,"active_object_store_bytes":20628,"retained_checkpoint_count":25,"max_physical_event_depth":24,"restored_pinned_target":true},{"restore_ns":14883995,"active_object_store_bytes":20628,"retained_checkpoint_count":25,"max_physical_event_depth":24,"restored_pinned_target":true},{"restore_ns":16165018,"active_object_store_bytes":20628,"retained_checkpoint_count":25,"max_physical_event_depth":24,"restored_pinned_target":true},{"restore_ns":14028787,"active_object_store_bytes":20628,"retained_checkpoint_count":25,"max_physical_event_depth":24,"restored_pinned_target":true},{"restore_ns":15765905,"active_object_store_bytes":20628,"retained_checkpoint_count":25,"max_physical_event_depth":24,"restored_pinned_target":true}],"restore_latency":{"samples_ns":[14497995,14883995,16165018,14028787,15765905],"min_ns":14028787,"median_ns":14883995,"max_ns":16165018}},
    {"name":"recent-window","policy":{"recent_window_seconds":6,"periodic_interval_seconds":0,"storage_budget_bytes":null},"samples":[{"restore_ns":7347822,"active_object_store_bytes":10956,"retained_checkpoint_count":2,"max_physical_event_depth":1,"restored_pinned_target":true},{"restore_ns":7623910,"active_object_store_bytes":10956,"retained_checkpoint_count":2,"max_physical_event_depth":1,"restored_pinned_target":true},{"restore_ns":7433891,"active_object_store_bytes":10956,"retained_checkpoint_count":2,"max_physical_event_depth":1,"restored_pinned_target":true},{"restore_ns":7596015,"active_object_store_bytes":10956,"retained_checkpoint_count":2,"max_physical_event_depth":1,"restored_pinned_target":true},{"restore_ns":7522821,"active_object_store_bytes":10956,"retained_checkpoint_count":2,"max_physical_event_depth":1,"restored_pinned_target":true}],"restore_latency":{"samples_ns":[7347822,7623910,7433891,7596015,7522821],"min_ns":7347822,"median_ns":7522821,"max_ns":7623910}},
    {"name":"periodic","policy":{"recent_window_seconds":0,"periodic_interval_seconds":6,"storage_budget_bytes":null},"samples":[{"restore_ns":19506931,"active_object_store_bytes":13003,"retained_checkpoint_count":6,"max_physical_event_depth":5,"restored_pinned_target":true},{"restore_ns":9823799,"active_object_store_bytes":13003,"retained_checkpoint_count":6,"max_physical_event_depth":5,"restored_pinned_target":true},{"restore_ns":8727073,"active_object_store_bytes":13003,"retained_checkpoint_count":6,"max_physical_event_depth":5,"restored_pinned_target":true},{"restore_ns":10711908,"active_object_store_bytes":13003,"retained_checkpoint_count":6,"max_physical_event_depth":5,"restored_pinned_target":true},{"restore_ns":9650945,"active_object_store_bytes":13003,"retained_checkpoint_count":6,"max_physical_event_depth":5,"restored_pinned_target":true}],"restore_latency":{"samples_ns":[19506931,9823799,8727073,10711908,9650945],"min_ns":8727073,"median_ns":9823799,"max_ns":19506931}},
    {"name":"storage-budget","policy":{"recent_window_seconds":30,"periodic_interval_seconds":0,"storage_budget_bytes":1200},"samples":[{"restore_ns":8866071,"active_object_store_bytes":12040,"retained_checkpoint_count":3,"max_physical_event_depth":2,"restored_pinned_target":true},{"restore_ns":8758068,"active_object_store_bytes":12040,"retained_checkpoint_count":3,"max_physical_event_depth":2,"restored_pinned_target":true},{"restore_ns":8667945,"active_object_store_bytes":12040,"retained_checkpoint_count":3,"max_physical_event_depth":2,"restored_pinned_target":true},{"restore_ns":8107185,"active_object_store_bytes":12040,"retained_checkpoint_count":3,"max_physical_event_depth":2,"restored_pinned_target":true},{"restore_ns":8578062,"active_object_store_bytes":12040,"retained_checkpoint_count":3,"max_physical_event_depth":2,"restored_pinned_target":true}],"restore_latency":{"samples_ns":[8866071,8758068,8667945,8107185,8578062],"min_ns":8107185,"median_ns":8667945,"max_ns":8866071}}
],
"notes":"active_object_store_bytes excludes temporary quarantine after prune; restore timings include guarded safety-checkpoint handling and are host-specific evidence only."
}
